{
  "schema_version": 2,
  "upstream": {
    "name": "lsdefine/GenericAgent",
    "remote": "https://github.com/lsdefine/GenericAgent.git",
    "reviewed_ref": "main",
    "reviewed_commit": "8ea95336511b4648c2ffb713d784541b3b999813",
    "reviewed_at": "2026-08-27",
    "release_context": "f06d550..8ea9533 review refresh: the 24 upstream commits do not change assets/tmwd_cdp_bridge and the reviewed source hashes remain identical; browser67 keeps the existing manual-merge decision with no direct sync"
  },
  "decision": {
    "extension_merge_mode": "manual_merge_preserve_local_bridge_features",
    "direct_sync_allowed": false,
    "local_extension_action": "keep_local_bridge_and_selectively_cherry_pick_future_useful_hunks",
    "lock_action": "keep_UPSTREAM.lock.json_at_extension_sync_baseline_until_intentional_extension_sync",
    "reason": "Latest upstream 8ea95336511b4648c2ffb713d784541b3b999813 was checked with upstream:audit:latest. The f06d550..8ea9533 compare contains no assets/tmwd_cdp_bridge changes and the reviewed source hashes match the existing ledger. Extension drift remains changed_files=background.js,browser67/managed-content.js,browser67/runtime.js,content.js,disable_dialogs.js,manifest.json; upstream background.js is still missing local enhanced bridge features (batch_uses_handle_tabs,cdp_tabid_validation,cookies_tabid_validation,handle_tabs_dispatch,include_unscriptable,numeric_tab_id_validation,tabs_close,tabs_get,unsupported_tabs_method,ws_exec_tabid_validation), so direct sync remains disabled and the local bridge stays authoritative."
  },
  "extension_review": {
    "changed_files": [
      "background.js",
      "browser67/managed-content.js",
      "browser67/runtime.js",
      "content.js",
      "disable_dialogs.js",
      "manifest.json"
    ],
    "background_preserve_features": [
      "batch_uses_handle_tabs",
      "cdp_tabid_validation",
      "cookies_tabid_validation",
      "handle_tabs_dispatch",
      "include_unscriptable",
      "numeric_tab_id_validation",
      "tabs_close",
      "tabs_get",
      "unsupported_tabs_method",
      "ws_exec_tabid_validation"
    ],
    "per_file_decision": [
      {
        "file": "background.js",
        "action": "keep_local_bridge_features",
        "risk": "high_if_blind_synced"
      },
      {
        "file": "content.js",
        "action": "selective_cherry_pick_after_review",
        "risk": "medium"
      },
      {
        "file": "disable_dialogs.js",
        "action": "keep_local_no_behavior_change",
        "risk": "none_final_newline_only"
      },
      {
        "file": "manifest.json",
        "action": "selective_cherry_pick_after_review",
        "risk": "medium"
      },
      {
        "file": "browser67/managed-content.js",
        "action": "do_not_remove_without_manual_review",
        "risk": "high"
      },
      {
        "file": "browser67/runtime.js",
        "action": "do_not_remove_without_manual_review",
        "risk": "high"
      }
    ],
    "reviewed_source_files": [
      {
        "path": "background.js",
        "sha256": "f11efbe131d344da5399f9ebac71f93ca5f0c0d45d1dbda5b46ff9765fb62822"
      },
      {
        "path": "content.js",
        "sha256": "49a7b567416b6d152c1cf961965b52fe4837fb6307265b7530c78a4a9f56c486"
      },
      {
        "path": "disable_dialogs.js",
        "sha256": "585b84fc84a2283499413da68c52d32f95ca161e66c07b9b422bbed07bc07d43"
      },
      {
        "path": "manifest.json",
        "sha256": "1bf72fd37bcfbafe0e2e577aca48770f16147e41366d47edca08b148fe5f69e9"
      },
      {
        "path": "popup.html",
        "sha256": "5d85260b3e8a820b5add8c6d067904bcbbade8a0090444ee604f9dd72bce9513"
      },
      {
        "path": "popup.js",
        "sha256": "289ef3b64713226e5c815df0bbbb05a66ebf1704b36c5e85df4e769493af3146"
      }
    ]
  },
  "absorbed_reference": {
    "paths": [
      "docs/upstream/genericagent/macljqCtrl.py",
      "docs/upstream/genericagent/ljqCtrl-notes.md",
      "docs/upstream/genericagent/README.md"
    ],
    "notes": "GenericAgent macljqCtrl/AX and ljqCtrl DPI/click-check ideas are retained as audited reference and diagnostics, not default execution providers."
  }
}
